{
  "version": "1.1.0",
  "source": "CropGraph pest-species fixture. Slug-keyed scientific names for every pest and disease in pest-disease.json. Each entry cites the taxonomic authority used (GBIF Backbone Taxonomy, UC IPM Online, Cornell Cooperative Extension, UF/IFAS Featured Creatures, EPPO Global Database, ICTV Master Species List, USDA-ARS, Penn State Extension). Physiological disorders carry scientificName: null with an explicit disorder note in the source.",
  "license": "CC-BY-4.0",
  "lastUpdated": "2026-05-17",
  "entries": [
    {
      "slug": "alfalfa-mosaic-virus",
      "commonName": "Alfalfa Mosaic Virus",
      "scientificName": "Alfamovirus AMV",
      "source": "ICTV Master Species List"
    },
    {
      "slug": "alfalfa-weevil",
      "commonName": "Alfalfa Weevil",
      "scientificName": "Hypera postica",
      "source": "GBIF Backbone Taxonomy"
    },
    {
      "slug": "alternaria-leaf-blight",
      "commonName": "Alternaria Leaf Blight",
      "scientificName": "Alternaria spp.",
      "source": "Cornell Cooperative Extension; UC IPM Online"
    },
    {
      "slug": "alternaria-leaf-blight-carrot",
      "commonName": "Alternaria Leaf Blight of Carrot",
      "scientificName": "Alternaria dauci",
      "source": "Cornell Cooperative Extension"
    },
    {
      "slug": "alternaria-leaf-spot",
      "commonName": "Alternaria Leaf Spot",
      "scientificName": "Alternaria brassicicola",
      "source": "UC IPM Online"
    },
    {
      "slug": "alternaria-stem-canker",
      "commonName": "Alternaria Stem Canker",
      "scientificName": "Alternaria alternata f.sp. lycopersici",
      "source": "UC IPM Online"
    },
    {
      "slug": "angular-leaf-spot",
      "commonName": "Angular Leaf Spot",
      "scientificName": "Pseudomonas syringae pv. lachrymans",
      "source": "Cornell Cooperative Extension"
    },
    {
      "slug": "anthracnose",
      "commonName": "Anthracnose",
      "scientificName": "Colletotrichum spp.",
      "source": "Cornell Cooperative Extension; UC IPM Online"
    },
    {
      "slug": "aphid-cabbage",
      "commonName": "Cabbage Aphid",
      "scientificName": "Brevicoryne brassicae",
      "source": "GBIF Backbone Taxonomy; UC IPM Online"
    },
    {
      "slug": "aphid-corn-leaf",
      "commonName": "Corn Leaf Aphid",
      "scientificName": "Rhopalosiphum maidis",
      "source": "USDA-ARS; Cornell Cooperative Extension"
    },
    {
      "slug": "aphid-foxglove",
      "commonName": "Foxglove Aphid",
      "scientificName": "Aulacorthum solani",
      "source": "Cornell Cooperative Extension"
    },
    {
      "slug": "aphid-green-peach",
      "commonName": "Green Peach Aphid",
      "scientificName": "Myzus persicae",
      "source": "GBIF Backbone Taxonomy; UC IPM Online"
    },
    {
      "slug": "aphid-lettuce",
      "commonName": "Lettuce Aphid",
      "scientificName": "Nasonovia ribisnigri",
      "source": "UC IPM Online"
    },
    {
      "slug": "aphid-melon",
      "commonName": "Melon Aphid",
      "scientificName": "Aphis gossypii",
      "source": "UC IPM Online"
    },
    {
      "slug": "aphid-potato",
      "commonName": "Potato Aphid",
      "scientificName": "Macrosiphum euphorbiae",
      "source": "Cornell Cooperative Extension; UC IPM Online"
    },
    {
      "slug": "aphid-rosy-apple",
      "commonName": "Rosy Apple Aphid",
      "scientificName": "Dysaphis plantaginea",
      "source": "Cornell Cooperative Extension"
    },
    {
      "slug": "aphid-spiraea",
      "commonName": "Spirea Aphid",
      "scientificName": "Aphis spiraecola",
      "source": "UF/IFAS Featured Creatures"
    },
    {
      "slug": "aphid-turnip",
      "commonName": "Turnip Aphid",
      "scientificName": "Lipaphis erysimi",
      "source": "UC IPM Online"
    },
    {
      "slug": "aphid-willow-carrot",
      "commonName": "Willow-Carrot Aphid",
      "scientificName": "Cavariella aegopodii",
      "source": "Cornell Cooperative Extension"
    },
    {
      "slug": "apple-maggot",
      "commonName": "Apple Maggot",
      "scientificName": "Rhagoletis pomonella",
      "source": "GBIF Backbone Taxonomy"
    },
    {
      "slug": "apple-scab",
      "commonName": "Apple Scab",
      "scientificName": "Venturia inaequalis",
      "source": "GBIF Backbone Taxonomy"
    },
    {
      "slug": "asian-citrus-psyllid",
      "commonName": "Asian Citrus Psyllid",
      "scientificName": "Diaphorina citri",
      "source": "UF/IFAS Featured Creatures"
    },
    {
      "slug": "asparagus-aphid",
      "commonName": "Asparagus Aphid",
      "scientificName": "Brachycorynella asparagi",
      "source": "UC IPM Online"
    },
    {
      "slug": "asparagus-beetle",
      "commonName": "Asparagus Beetle",
      "scientificName": "Crioceris asparagi",
      "source": "GBIF Backbone Taxonomy"
    },
    {
      "slug": "asparagus-miner",
      "commonName": "Asparagus Miner",
      "scientificName": "Ophiomyia simplex",
      "source": "Cornell Cooperative Extension"
    },
    {
      "slug": "asparagus-rust",
      "commonName": "Asparagus Rust",
      "scientificName": "Puccinia asparagi",
      "source": "GBIF Backbone Taxonomy"
    },
    {
      "slug": "aster-leafhopper",
      "commonName": "Aster Leafhopper",
      "scientificName": "Macrosteles quadrilineatus",
      "source": "Cornell Cooperative Extension"
    },
    {
      "slug": "aster-yellows",
      "commonName": "Aster Yellows",
      "scientificName": "Candidatus Phytoplasma asteris",
      "source": "Cornell Cooperative Extension"
    },
    {
      "slug": "bacterial-blotch",
      "commonName": "Bacterial Blotch",
      "scientificName": "Pseudomonas tolaasii",
      "source": "Penn State Extension"
    },
    {
      "slug": "bacterial-canker",
      "commonName": "Bacterial Canker",
      "scientificName": "Pseudomonas syringae",
      "source": "Cornell Cooperative Extension"
    },
    {
      "slug": "bacterial-speck",
      "commonName": "Bacterial Speck",
      "scientificName": "Pseudomonas syringae pv. tomato",
      "source": "Cornell Cooperative Extension"
    },
    {
      "slug": "bacterial-spot",
      "commonName": "Bacterial Spot",
      "scientificName": "Xanthomonas euvesicatoria",
      "source": "Cornell Cooperative Extension"
    },
    {
      "slug": "bacterial-wilt",
      "commonName": "Bacterial Wilt",
      "scientificName": "Erwinia tracheiphila",
      "source": "Cornell Cooperative Extension"
    },
    {
      "slug": "bacterial-wilt-cucurbit",
      "commonName": "Bacterial Wilt of Cucurbits",
      "scientificName": "Erwinia tracheiphila",
      "source": "Cornell Cooperative Extension"
    },
    {
      "slug": "bald-faced-hornet",
      "commonName": "Bald-Faced Hornet",
      "scientificName": "Dolichovespula maculata",
      "source": "Penn State Extension"
    },
    {
      "slug": "banded-cucumber-beetle",
      "commonName": "Banded Cucumber Beetle",
      "scientificName": "Diabrotica balteata",
      "source": "UF/IFAS Featured Creatures"
    },
    {
      "slug": "barley-yellow-dwarf-virus",
      "commonName": "Barley Yellow Dwarf Virus",
      "scientificName": "Luteovirus BYDV",
      "source": "ICTV Master Species List"
    },
    {
      "slug": "basil-downy-mildew",
      "commonName": "Basil Downy Mildew",
      "scientificName": "Peronospora belbahrii",
      "source": "Cornell Cooperative Extension"
    },
    {
      "slug": "bean-leaf-beetle",
      "commonName": "Bean Leaf Beetle",
      "scientificName": "Cerotoma trifurcata",
      "source": "GBIF Backbone Taxonomy"
    },
    {
      "slug": "bean-rust",
      "commonName": "Bean Rust",
      "scientificName": "Uromyces appendiculatus",
      "source": "GBIF Backbone Taxonomy"
    },
    {
      "slug": "beet-armyworm",
      "commonName": "Beet Armyworm",
      "scientificName": "Spodoptera exigua",
      "source": "UC IPM Online"
    },
    {
      "slug": "beet-leafhopper",
      "commonName": "Beet Leafhopper",
      "scientificName": "Circulifer tenellus",
      "source": "UC IPM Online"
    },
    {
      "slug": "bitter-pit",
      "commonName": "Bitter Pit",
      "scientificName": null,
      "source": "Physiological disorder (calcium deficiency in apple); not a biological agent. Cornell Cooperative Extension."
    },
    {
      "slug": "bitter-rot",
      "commonName": "Bitter Rot",
      "scientificName": "Colletotrichum fioriniae",
      "source": "Cornell Cooperative Extension"
    },
    {
      "slug": "black-cherry-aphid",
      "commonName": "Black Cherry Aphid",
      "scientificName": "Myzus cerasi",
      "source": "GBIF Backbone Taxonomy"
    },
    {
      "slug": "black-rot",
      "commonName": "Black Rot",
      "scientificName": "Xanthomonas campestris pv. campestris",
      "source": "Cornell Cooperative Extension"
    },
    {
      "slug": "blister-beetle",
      "commonName": "Blister Beetle",
      "scientificName": "Epicauta spp.",
      "source": "Cornell Cooperative Extension"
    },
    {
      "slug": "blossom-end-rot",
      "commonName": "Blossom End Rot",
      "scientificName": null,
      "source": "Physiological disorder (calcium translocation failure under water stress in tomato, pepper, eggplant, watermelon); not a biological agent. UC IPM Online."
    },
    {
      "slug": "blueberry-gall-midge",
      "commonName": "Blueberry Gall Midge",
      "scientificName": "Dasineura oxycoccana",
      "source": "UF/IFAS Featured Creatures"
    },
    {
      "slug": "blueberry-leaf-rust",
      "commonName": "Blueberry Leaf Rust",
      "scientificName": "Thekopsora minima",
      "source": "Cornell Cooperative Extension"
    },
    {
      "slug": "blueberry-maggot",
      "commonName": "Blueberry Maggot",
      "scientificName": "Rhagoletis mendax",
      "source": "GBIF Backbone Taxonomy"
    },
    {
      "slug": "blueberry-stem-blight",
      "commonName": "Blueberry Stem Blight",